<?xml version="1.0" encoding="utf-8"?>
<level xmlns="http://example.com/level"
       xmlns:xsi="http://www.w3.org/2001/XMLSchema-instance"
       xsi:schemaLocation="http://example.com/level level.xsd">
    <player x="5" y="2" name="player1" />
    <tileset>tileset</tileset>
    <tileSize width="16" height="16" />
    <collisionMask>1,2,3,0,7,4,6,5</collisionMask>
    <enemies>
        <enemy x="5" y="7" />
        <enemy x="5" y="17" />
    </enemies>
    <map width="10" height="21">
        <row>1,2,2,2,2,2,2,2,2,3</row>
        <row>0,8,8,8,8,8,8,8,8,7</row>
        <row>0,8,8,8,8,8,8,8,8,7</row>
        <row>0,8,8,8,8,8,8,8,8,7</row>
        <row>0,8,8,8,8,8,8,8,8,7</row>
        <row>0,8,8,8,8,8,8,8,8,7</row>
        <row>0,8,8,8,8,8,8,8,8,7</row>
        <row>0,8,8,8,8,8,8,8,8,7</row>
        <row>0,8,8,8,8,8,8,8,8,7</row>
        <row>4,2,2,3,8,8,1,2,2,6</row>
        <row>8,8,8,7,8,8,0,8,8,8</row>
        <row>1,2,2,6,8,8,4,2,2,3</row>
        <row>0,8,8,8,8,8,8,8,8,7</row>
        <row>0,8,8,8,8,8,8,8,8,7</row>
        <row>0,8,8,8,8,8,8,8,8,7</row>
        <row>0,8,8,8,8,8,8,8,8,7</row>
        <row>0,8,8,8,8,8,8,8,8,7</row>
        <row>0,8,8,8,8,8,8,8,8,7</row>
        <row>0,8,8,8,8,8,8,8,8,7</row>
        <row>0,8,8,8,8,8,8,8,8,7</row>
        <row>4,5,5,5,5,5,5,5,5,6</row>
    </map>
</level>
